{"audience":"furatena.preview","binding":{"head_sha":"aaaaaaaaaaaaaaaaaaaaaaaaaaaaaaaaaaaaaaaa","origin":"https://pr-518.preview.example","pull_request_number":518,"repository_id":"repository-4242"},"issuer":"https://auth.furatena.example/preview","jti":"grant_jti_12345678901234567890","key_id":"preview-key-2030-01","reason":"head_changed","record_type":"furatena.preview-auth.revocation","revoked_at":"2030-01-01T00:02:00Z","schema_version":1,"sequence":1,"subject":"reviewer:stable-pseudonym"}
